{
  "title": "2030 三種未來：樂觀、一般、悲觀",
  "targetDurationSeconds": 308,
  "language": "zh-Hant",
  "voice": {
    "tool": "edge-tts",
    "voice": "zh-TW-HsiaoChenNeural",
    "rate": "+5%",
    "pitch": "-3Hz",
    "volume": "+0%",
    "pronunciationMap": "data/pronunciation-map.json",
    "displayTextPattern": "assets/audio/slide-XX.display.txt",
    "ttsTextPattern": "assets/audio/slide-XX.tts.txt"
  },
  "slides": [
    {
      "id": "slide-01",
      "title": "2030 不是預言",
      "chapter": "prologue",
      "durationTarget": 18.2,
      "image": "assets/images/slide-01-prologue-branching-futures.png",
      "subtitle": "2030 不是一個目的地，而是今天決策的可見分岔。",
      "narration": "如果我以一個 AI 的視角看 2030，我不會把它說成一個單一未來。它更像三條同時存在的路：同一批技術，同一個地球，同樣的人口壓力，卻因為制度、信任與分配方式不同，長成完全不同的世界。"
    },
    {
      "id": "slide-02",
      "title": "硬約束",
      "chapter": "evidence",
      "durationTarget": 21.9,
      "image": "assets/images/slide-02-evidence-observatory.png",
      "subtitle": "AI、氣候、能源、就業、健康、教育與人口，是 2030 的共同底盤。",
      "narration": "這不是純幻想。到 2030，AI 會更深地進入工作和公共服務；世界仍要面對減排與適應壓力；能源轉型會加速但受電網和政策限制；就業會重組；健康與教育人力仍可能緊張；而 SDG 進度已經提醒我們，全球發展不是自動前進。"
    },
    {
      "id": "slide-03",
      "title": "情境方法",
      "chapter": "evidence",
      "durationTarget": 21.4,
      "image": "assets/images/slide-03-method-observatory.png",
      "subtitle": "三種版本使用同一組證據，只改變協調能力與信任水準。",
      "narration": "所以我把 2030 做成三個版本。樂觀版不是奇蹟，而是協調成功；一般版不是失敗，而是局部適應；悲觀版也不是末日，而是碎片化失控。三者的差別，不是有沒有 AI，而是 AI 服務誰、誰能承擔風險、誰被排除在外。"
    },
    {
      "id": "slide-04",
      "title": "樂觀版：會呼吸的城市",
      "chapter": "optimistic",
      "durationTarget": 22.6,
      "image": "assets/images/slide-04-optimistic-city.png",
      "subtitle": "如果治理與基礎建設跟上，城市會先變得更安靜、更涼、更可走。",
      "narration": "在樂觀的 2030，最明顯的變化不是飛天車，而是城市終於會呼吸。樹蔭、公共交通、分散式能源、排水與降溫設計被視為安全基礎設施。AI 在背後調度維修、需求和風險，人們感受到的是更少的等待、更少的熱、更少的無助。"
    },
    {
      "id": "slide-05",
      "title": "樂觀版：AI 放大照護",
      "chapter": "optimistic",
      "durationTarget": 20.5,
      "image": "assets/images/slide-05-optimistic-care-learning.png",
      "subtitle": "最好的 AI 不是取代老師和護士，而是讓他們有時間做真正需要人的事。",
      "narration": "在這條路上，AI 最有價值的地方不是炫技，而是補足照護與教育的縫隙。老師用它做個別化教案，護士用它做早期篩檢，社工用它提早發現風險。人仍在前台，只是被從文書、排程和低價值重複工作裡釋放出來。"
    },
    {
      "id": "slide-06",
      "title": "樂觀版：能源成為韌性",
      "chapter": "optimistic",
      "durationTarget": 18.9,
      "image": "assets/images/slide-06-optimistic-energy.png",
      "subtitle": "清潔能源不是單一技術勝利，而是電網、儲能、需求管理與自然修復一起工作。",
      "narration": "樂觀版的能源轉型不是只把化石燃料換成太陽能板。真正改變的是整個系統：儲能、電網、需求反應、建築效率和生態修復一起運作。2030 仍然有極端天氣，但社會不再每次都被打回原點。"
    },
    {
      "id": "slide-07",
      "title": "樂觀版：信任有介面",
      "chapter": "optimistic",
      "durationTarget": 18.4,
      "image": "assets/images/slide-07-optimistic-governance.png",
      "subtitle": "透明審計、公共資料信託、模型責任制，讓 AI 不只是效率工具。",
      "narration": "這個版本最重要的發明，其實是信任的介面。公共模型要被審計，資料使用要可追蹤，重要決策要能申訴。當 AI 被設計成可問責的基礎設施，它才可能擴大人的能力，而不是把權力藏進黑箱。"
    },
    {
      "id": "slide-08",
      "title": "一般版：進步但擁擠",
      "chapter": "baseline",
      "durationTarget": 20.8,
      "image": "assets/images/slide-08-baseline-city.png",
      "subtitle": "一般情境裡，2030 不是壞世界，而是一個一直在補洞的世界。",
      "narration": "一般版比較像多數城市可能真正經歷的 2030。AI 工具到處都有，公共交通更智慧，熱浪應對也變多；但老舊建築、電網瓶頸、房租壓力和區域不平等仍然存在。它不是失敗，只是進步總是晚一步到達最需要的人。"
    },
    {
      "id": "slide-09",
      "title": "一般版：每個人都有 Copilot",
      "chapter": "baseline",
      "durationTarget": 18.2,
      "image": "assets/images/slide-09-baseline-work-school.png",
      "subtitle": "工作和學習更快，但注意力、技能更新與心理負擔也更重。",
      "narration": "在一般版裡，每個人幾乎都有某種 AI copilot。效率提高，入門門檻下降，但節奏也更快。工作者需要不斷重學，學生需要分辨機器幫助和真實理解，家庭需要在便利與過載之間找到界線。"
    },
    {
      "id": "slide-10",
      "title": "一般版：轉型卡在電網",
      "chapter": "baseline",
      "durationTarget": 19.3,
      "image": "assets/images/slide-10-baseline-energy.png",
      "subtitle": "再多清潔能源，也需要傳輸、儲能、審批、材料與社會共識。",
      "narration": "能源轉型在一般版裡繼續前進，但最慢的部分不是發明，而是部署。電網不夠、審批太慢、供應鏈緊張、地方接受度不足。於是 2030 同時有更多乾淨電力，也有更多因系統接不上而產生的挫折。"
    },
    {
      "id": "slide-11",
      "title": "一般版：公共系統做分診",
      "chapter": "baseline",
      "durationTarget": 20.1,
      "image": "assets/images/slide-11-baseline-triage.png",
      "subtitle": "政府、醫療、教育與災害應對沒有崩潰，但常常只能先處理最急的事。",
      "narration": "一般版最大的感覺，是公共系統一直在分診。醫護、教師、社工和災害應對者都有 AI 工具，但人手仍不足。許多地方能避免最糟結果，卻很難創造餘裕。這是一個能撐住、卻不太能喘氣的 2030。"
    },
    {
      "id": "slide-12",
      "title": "悲觀版：技術變成邊界",
      "chapter": "pessimistic",
      "durationTarget": 21.5,
      "image": "assets/images/slide-12-pessimistic-fragmented-city.png",
      "subtitle": "悲觀情境不是沒有技術，而是技術把安全、機會與信任切成更小的圈。",
      "narration": "悲觀版的 2030 不是低科技世界，反而充滿高科技。問題是，高科技成了邊界。富裕區有冷卻、電力和安全；脆弱社區承擔熱浪、洪水、失業和監控。AI 沒有消失，它只是更常被用來排序、排除和防守。"
    },
    {
      "id": "slide-13",
      "title": "悲觀版：氣候衝擊疊加脆弱電網",
      "chapter": "pessimistic",
      "durationTarget": 19.8,
      "image": "assets/images/slide-13-pessimistic-climate-grid.png",
      "subtitle": "當熱浪、洪水、電力與供應鏈同時失靈，社會不只是受災，而是失去恢復速度。",
      "narration": "如果減排和適應都慢一步，2030 的危機會變成複合型。熱浪碰上停電，洪水碰上保險退場，供應鏈碰上糧食和醫療中斷。最可怕的不是某一次災害，而是每次恢復都更慢，下一次衝擊卻更快到來。"
    },
    {
      "id": "slide-14",
      "title": "悲觀版：真相成本上升",
      "chapter": "pessimistic",
      "durationTarget": 19.5,
      "image": "assets/images/slide-14-pessimistic-disinfo-work.png",
      "subtitle": "合成媒體、詐騙、失業焦慮與政治動員混在一起，讓信任變得昂貴。",
      "narration": "悲觀版裡，資訊污染成為日常稅。每個人都要花更多時間確認影像、身份、招聘、新聞和承諾是真是假。當工作轉型沒有安全網，合成媒體又能精準煽動恐懼，社會會把大量能量浪費在互相防備。"
    },
    {
      "id": "slide-15",
      "title": "三個未來都還在路上",
      "chapter": "conclusion",
      "durationTarget": 26.5,
      "image": "assets/images/slide-15-finale-choice-room.png",
      "subtitle": "2030 的問題不是科技會不會來，而是我們能不能把科技變成公共能力。",
      "narration": "所以，2030 最重要的問題不是 AI 會有多聰明，而是人類社會能不能變得更會協調。樂觀、一般、悲觀三個版本，現在都還在路上。真正的分水嶺，是 2026 到 2030 這幾年，我們如何建電網，如何訓練人，如何照護弱者，如何治理模型，以及如何讓信任重新變得便宜。"
    }
  ]
}
